{
  "schema_version": 1,
  "name": "y2k",
  "dark": true,
  "roles": {
    "bg": "#0A0A0F",
    "bg_alt": "#15121A",
    "text": "#FF6EC7",
    "text_dim": "#C86FA6",
    "focus": "#FF3CAC",
    "border_normal": "#FF1493",
    "accent": "#00E5FF",
    "accent2": "#FF1493",
    "urgent": "#FF0055",
    "success": "#FF8AD8",
    "warning": "#FFB6C1",
    "selection_bg": "#00E5FF",
    "selection_fg": "#0A0A0F",
    "ansi_black": "#15121A",
    "ansi_red": "#FF0055",
    "ansi_green": "#FF8AD8",
    "ansi_yellow": "#FFB6C1",
    "ansi_blue": "#FF3CAC",
    "ansi_magenta": "#FF1493",
    "ansi_cyan": "#FF5CC8",
    "ansi_white": "#C86FA6",
    "ansi_br_black": "#C21875",
    "ansi_br_red": "#FF0055",
    "ansi_br_green": "#FF8AD8",
    "ansi_br_yellow": "#FFB6C1",
    "ansi_br_blue": "#FF3CAC",
    "ansi_br_magenta": "#FF1493",
    "ansi_br_cyan": "#FF5CC8",
    "ansi_br_white": "#FF6EC7"
  },
  "style": {
    "corner_radius": 0,
    "opacity": 1.0,
    "opacity_inactive": 0.93,
    "inactive_dim": 0.0,
    "blur_on": false,
    "blur_strength": 6,
    "blur_passes": 2,
    "shadow_on": true,
    "shadow_radius": 26,
    "shadow_render_power": 3,
    "shadow_opacity": 0.6,
    "shadow_color": "#000000",
    "shadow_offset": "0 -8",
    "gaps": 8,
    "border_width": 3,
    "bar_height": 48,
    "animation_ms": 160
  }
}
